Product Name,Price,Seller,Location,Amount Sold,Rating
Kylafood Seblak Original,19800,kylafood,Bandung,10000,4.9
"Seblak Rafael, Seblak Coet Instan Halal",23750,Brother Meat Shop,Depok,500,4.9
"Kylafood Seblak Rempah Autentik 115gr, Seblak Instan Halal",9405,Brother Meat Shop,Depok,100,4.9
Seblak Rafael/Seblak Coet Instan Halal,26600,Foodstocks,Jakarta Selatan,50,5.0
SEBLAK INSTANT TERMURAH,4450,Pusat Cuankie & Cemilan Frozen,Jakarta Timur,10000,4.8
KERUPUK SEBLAK PEDAS DAUN JERUK 100 GR,4500,BociKakang,Jakarta Selatan,500,4.8
Seblak Instan Pedas Home Made,3500,the Dhecip,Tangerang Selatan,3000,4.9
"Kylafood Seblak Cup Instan, Halal",11500,Brother Meat Shop,Depok,100,5.0
KERUPUK SEBLAK PEDAS / KRUPUK SEBLAK KERING DAUN JERUK PEDES,25000,LEGIT SNACK,Jakarta Barat,70,4.9
Kerupuk Seblak / Seblak / Kering Pedas /,10000,Anggris store,Kab. Bogor,50,4.8
"seblak kering pedas 250 gr/seblak kencur/kerupuk seblak,enak dan gurih",9999,aghniya,Tangerang Selatan,500,4.8
SEBRING KRUPUK KERUPUK SEBLAK KERING PEDAS DAUN JERUK 1KG CABE ASLI,16000,Aydaa Snack,Surakarta,100,4.9
kerupuk seblak kering pedas 1 kg keripik hot spicy camilan kekinian,41000,JAGO TOK PETOK,Surabaya,100,4.9
Seblak RAFAEL | Seblak MAMANG RAFAEL | Seblak Viral ORIGINAL TATANGGA,39500,Beauty DELUXE,Jakarta Barat,40,4.9
Krupuk seblak mawar rafael pedas 250gram,12500,Markas Makaroni,Kab. Bekasi,100,4.7
[250 gr] Kerupuk Seblak Pedas,11500,CamilanJati,Kab. Sidoarjo,40,5.0
Gelifood Seblak Instan Kerupuk Mawar Bumbu Kencur Rafael Pedas Gurih,15000,Lidigeli,Kab. Garut,250,4.8
Seblak Instan Komplit Pedas Gurih Nikmat,5999,Baso Aci Ayang,Kab. Garut,3000,4.9
Geli Food Seblak Ceker Tanpa Tulang Super Pedas 180gr,24000,Lidigeli,Kab. Garut,100,4.8
KERUPUK JABLAY/KERUPUK SEBLAK RASA PEDAS BERAT 250 GRAM,11500,aurel prima snack,Jakarta Barat,30,4.8
Kylafood Paket Seblak Cup isi 4 pcs,47260,kylafood,Bandung,14,5.0
Bundle - Basranger Seblak | Baso Aci Extra Pedas | Tulang Rangu,56300,Rak Sebelah,Jakarta Pusat,100,4.9
Kylafood Seblak Mie Baso Sapi Play,24200,kylafood,Bandung,250,4.9
Kerupuk Mawar Ukuran Kecil Warna Putih/Kerupuk Seblak Mentah 250 gr,15000,Mandumpang Jaya Olshop,Jakarta Pusat,6,5.0
"CUANKI TAHU TOPING BASO ACI, SEBLAK, MIE, ENAK DAN GURIH",18500,global cookware1,Jakarta Barat,100,4.9
Kerupuk seblak orens / kerupuk sari laut orange mentah,7000,home_nature,Kab. Tangerang,60,4.9
krupuk seblak hah pedas gurih 1kg,50000,Markas Makaroni,Kab. Bekasi,500,5.0
^; Seblak Rafael Asli Original | Seblak Coet Mamang Rafael,28000,siskaarinang2,Bandung,11,5.0
Agen Seblak Mommy,9750,Kenal Jaya Bandung,Bandung,3000,4.9
cuanki tahu kering seblak atau batagor kering isi 150 pcs,34999,CUANKI CULAMETAN,Kab. Garut,100,4.9
Seblak Basranger Extra Pedas 200gr,17300,Rak Sebelah,Jakarta Pusat,250,4.9
cuanki tahu gepeng isi 50 pcs toping seblak baso aci,19500,CUANKI CULAMETAN,Kab. Garut,100,4.9
siomay mini kering 1kg / gurilem toping seblak baso aci cuanki,25500,CuankiCulametan,Kab. Garut,100,4.9
cuanki pangsit segitiga atau cipet isi 40 pcs toping seblak baso aci,13999,CUANKI CULAMETAN,Kab. Garut,100,4.8
Seblak Instan Kenyang Murah Asli Bandung Reseller Tanpa Pengawet,7138,Berkah Food Bandung,Cimahi,7000,4.9
Kerupuk Merah Seblak 250gr BANDUNG,4750,yohangunawan94,Bandung,1000,5.0
BASO ACI HOMEMADE boci isi 6 baso aci tulang rangu seblak Boci sehot,3800,NomeL Shop,Surabaya,90,4.4
10 BUNGKUS SEBLAK COBEK ALA RAFAEL,55000,global cookware1,Jakarta Barat,9,5.0
seblak instan KSN frozen,10600,Pelangi Girls Naget 2,Depok,100,5.0
cuanki lidah aci 10 pcs murah toping seblak baso aci,3500,CuankiCulametan,Kab. Garut,80,5.0
cuanki lidah asli garut isi 150 pcs,32500,kira3arut,Kab. Garut,10000,4.9
Baso urat djuara sami raos/Baso Aci Urat /Seblak,26000,Snack Zone Official,Jakarta Selatan,19,5.0
Mie Seblak Geprek Sami Raos Khas Garut Seblak Instant Kekinian 160gr,19700,Gerai Snack Official Shop,Kab. Tangerang,100,4.7
Seblak Mommy,13900,Gerai Snack Official Shop,Kab. Tangerang,2000,4.6
Kerupuk Kering 250g Bahan Seblak Variasi Lengkap by GG,5579,gaiagarut,Kab. Garut,40,5.0
Kerupuk mawar putih mentah 1ball (5kg)/kerupuk seblak viral rafael,115000,Semesta kerupuk,Tangerang Selatan,40,5.0
SEBLAK JELETET MURNI (UNYUU),26500,Seblak Jeletet Murni,Jakarta Pusat,250,4.9
kerupuk seblak kencur pedas 100 gram,5000,keripikususkrisis,Kab. Gresik,60,4.9
Baso Aci Bapper Tulang Rangu Original Asli Bandung 220gr,25800,Foodstocks,Jakarta Selatan,1000,5.0
Keripik Singkong Kalimantan,21000,Pisang Goreng Madu Bu Nanik,Jakarta Barat,1000,4.8
Baso Aci Kriboow Special Wagyu Cincang Selera Martini,26970,Foodstocks,Jakarta Selatan,500,4.9
Keripik Tempe Oven,30500,Pisang Goreng Madu Bu Nanik,Jakarta Barat,4000,4.7
Basranger Baso Aci Cuanki Extra Pedas 200gr - Makanan Instan Premium,22140,Rak Sebelah,Jakarta Pusat,100,4.9
Kerupuk Seblak Pedas 200gr,12250,Utama.Snack,Surabaya,750,4.9
Baso urat djuara sami raos/Baso Aci Urat /Seblak,26000,Snackzone PP,Jakarta Pusat,26,5.0
SEBLAK INSTAN CUANKI/SEBLAK INSTAN MURAH/SEBLAK INSTAN,4999,dakar_ofc,Kab. Mojokerto,40,5.0
Bumbu Seblak 200 g Dengan Kerupuk,34980,MSH Rempah,Jakarta Selatan,80,5.0
Kerupuk Kampung / Kerupuk Kampoeng / Kerupuk Bawang,18000,Pisang Goreng Madu Bu Nanik,Jakarta Barat,750,4.9
Keripik Ubi Ungu Sari Roso,26000,Pisang Goreng Madu Bu Nanik,Jakarta Barat,250,5.0
Sabring kerupuk seblak jablay pedas Jumbo,15000,RIKI STORE 97,Kab. Bogor,20,4.8
Kerupuk indosari gado gado dan seblak,25900,Agen bawang goreng mas YO,Kab. Bogor,100,4.9
kerupuk bawang pedas seblak plastik 250gr,27500,DRSukses,Jakarta Selatan,17,5.0
Kerupuk Bawang Seblak Bintang Mentah / Kerupuk Tersanjung 100 gram,4500,DelimaFCB,Surabaya,19,5.0
aneka kerupuk mix untuk bahan seblak 100 gr,3499,aghniya,Tangerang Selatan,100,4.9
KERUPUK SEBLAK 250gr / KRUPUK SEBLAK DAUN JERUK / SEBLAK PEDAS,12500,Dapur Sehat21,Kab. Bandung,100,4.9
seblak jengkol pedas / okesnack,16000,oke snack,Jakarta Selatan,100,4.9
Seblak Instan khas bandung,3500,Gallery Al-aziz,Kab. Bandung,7,5.0
Kerupuk seblak Mawar / Seblak Rafael / Seblak viral 500 gr,18500,Bintang Snack & Camilan,Semarang,16,5.0
Kerupuk Seblak Pedas 160gr Jajanan Cemilan Murah Kekinian,10000,Warung Pak Hakim,Depok,1,5.0
"Seblak kuah instan , Seblak khas garut a",6000,iwan resistans leather,Kab. Garut,19,4.5
Bumbu Basah Seblak 5 Porsi Koki Jempol,4250,Happy Family Cooking,Kab. Bogor,11,5.0
BUBUK CABAI/CABE BASO ACI/BOCI/SEBLAK/CUANKI ECERAN,699,ArfaOnlineShop,Tangerang,250,5.0
Paket 7 Pcs Seblak Instan Ceu Nthien Khas Bandung Rasana Ngeunah Pisan,120000,Central Seblak Nusantara,Tangerang Selatan,17,4.9
Seblak Cocol Seblak Coet Seblak Viral Seblak Bumbu Basah Seblak rafael,6000,FAG COLLECTION,Surabaya,10,5.0
Kerupuk bawang orange 250gr / Krupuk seblak mentah bawang oren 250 gr,7500,PanganIndah,Tangerang,8,5.0
Cuanki Instan Bandung kuah pedas bulefood,14999,GEMLOV OFFICIAL,Cimahi,4,5.0
Baso Aci Instan Culametan khas Garut (isi 12),5999,CUANKI CULAMETAN,Kab. Garut,2000,4.9
Baso Aci Terciduk Pedas Jeruk,15300,Foodstocks,Jakarta Selatan,100,5.0
Baso Aci Instan Culametan khas Garut ( isi 6 ),4500,CUANKI CULAMETAN,Kab. Garut,3000,4.8
Gurilem Sangarrr,13000,The Little Snacks,Tangerang Selatan,2000,4.7
Kerupuk mawar putih mentah 500gram / kerupuk ikan mentah /seblak viral,13000,Semesta kerupuk,Tangerang Selatan,100,5.0
NAAGIH! PAKET MIX 12 pack : 4 Seblak 4 Cuanki 4 Boci Instant RESELLER!,44500,Ebay Store,Kab. Tangerang,5,5.0
Seblak Bantat Boboko Pedas Daun Jeruk Level 20 Khas Bandung 125g,17700,Gerai Snack Official Shop,Kab. Tangerang,40,4.9
Gelichips Seblak Kering Sebring Camilan Kerupuk Pedas Daun Jeruk 65 gr,15000,Lidigeli,Kab. Garut,70,4.7
KERUPUK MAWAR PUTIH MENTAH ISI 1KG / KERUPUK VIRAL SEBLAK COBEK,26000,Raabihah_kerupukgrosir,Bandung,40,4.9
siomay mini kering 250 gram toping seblak baso aci,7999,CUANKI CULAMETAN,Kab. Garut,250,4.9
Kerupuk Seblak Kencur Gurih Asin Pedas 10 pcs/pak,7000,SerbaAda_6699,Bandung,40,5.0
Seblak Rempah Autentik Kyla Food Khas Bandung 115 g,12700,Gerai Snack Official Shop,Kab. Tangerang,28,5.0
Kerupuk seblak jengkol pedas berat 250 gram enak renyah pedas,14550,keripikususkrisis,Kab. Gresik,30,4.9
BUNDLING SEBLAK OIFYOO (isi 5 packs),25380,oifyoo_mozzarella,Bandung,16,4.8
KRUPUK SEBLAK PEDAS DAUN JERUK,8000,Ri_store.id,Makassar,27,4.2
